<?xml version="1.0" encoding="UTF-8"?>
<DroneTarget xmlns="http://www.example.com/drone"
             xmlns:xsi="http://www.w3.org/2001/XMLSchema-instance"
             xsi:schemaLocation="http://www.example.com/drone drone_target.xsd">

    <Drone id="d1">
        <Model>DJI Mavic</Model>
        <Status>active</Status>
    </Drone>

    <Drone id="d2">
        <Model>DJI Phantom</Model>
        <Status>inactive</Status>
    </Drone>

    <Target id="t1">
        <Name>Car</Name>
        <Type>car</Type>
        <Coordinates precision="high">
            <Latitude>55.7558</Latitude>
            <Longitude>37.6176</Longitude>
            <Altitude>120.5</Altitude>
        </Coordinates>
    </Target>

    <Target id="t2">
        <Name>Building</Name>
        <Type>building</Type>
        <Coordinates precision="medium">
            <Latitude>55.7600</Latitude>
            <Longitude>37.6200</Longitude>
            <Altitude>150.0</Altitude>
        </Coordinates>
    </Target>

    <Photo id="p1">
        <DroneID>d1</DroneID>
        <TargetID>t1</TargetID>
        <DateTime>2025-02-01T12:00:00Z</DateTime>
        <FilePath>/photos/photo1.jpg</FilePath>
        <Coordinates precision="high">
            <Latitude>55.7558</Latitude>
            <Longitude>37.6176</Longitude>
            <Altitude>120.5</Altitude>
        </Coordinates>
        <PhotoMetadata>
            <Resolution>1920x1080</Resolution>
            <FileSize>2.5MB</FileSize>
            <Format>JPEG</Format>
        </PhotoMetadata>
    </Photo>

    <Photo id="p2">
        <DroneID>d2</DroneID>
        <TargetID>t2</TargetID>
        <DateTime>2025-02-02T14:30:00Z</DateTime>
        <FilePath>/photos/photo2.jpg</FilePath>
        <Coordinates precision="medium">
            <Latitude>55.7600</Latitude>
            <Longitude>37.6200</Longitude>
            <Altitude>150.0</Altitude>
        </Coordinates>
        <PhotoMetadata>
            <Resolution>1280x720</Resolution>
            <FileSize>1.8MB</FileSize>
            <Format>PNG</Format>
        </PhotoMetadata>
    </Photo>
</DroneTarget>
