<?xml version="1.0" encoding="UTF-8"?>
<DroneTarget xmlns="http://www.example.com/drone"
             xmlns:xsi="http://www.w3.org/2001/XMLSchema-instance"
             xsi:schemaLocation="http://www.example.com/drone drone_target.xsd">
    <!-- Пример дрона -->
    <Drone id="d1" model="DJI Mavic" status="active">
        <Model>DJI Mavic</Model>
        <Status>active</Status>
    </Drone>
    <!-- Пример цели -->
    <Target id="t1" name="Car" type="car">
        <Name>Car</Name>
        <Type>car</Type>
        <Coordinates precision="high">
            <Latitude>55.7558</Latitude>
            <Longitude>37.6176</Longitude>
            <Altitude>120.5</Altitude>
        </Coordinates>
    </Target>

    <!-- Пример фотографии -->
    <Photo id="p1" droneID="d1" targetID="t1" dateTime="2023-10-01T12:00:00Z" filePath="/photos/photo1.jpg">
        <DroneID>d1</DroneID>
        <TargetID>t1</TargetID>
        <DateTime>2023-10-01T12:00:00Z</DateTime>
        <FilePath>/photos/photo1.jpg</FilePath>
        <PhotoMetadata>
            <Resolution>1920x1080</Resolution>
            <FileSize>2.5MB</FileSize>
            <Format>JPEG</Format>
        </PhotoMetadata>
    </Photo>
</DroneTarget>